{
  "name": "grumpy-senior-engineer-workflow",
  "version": "1.5.0",
  "description": "Shared Claude Code and Codex workflow for project context, architecture decisions, ten-section plans, and approved implementation. Optional Ponytail skills support scoped audits, design challenges, milestone reviews, and documented debt comparisons. User approval remains required.",
  "author": {
    "name": "Olivier Morel",
    "email": "olivier@devbox.ch"
  },
  "repository": "https://github.com/omorel/ai-tools-marketplace",
  "keywords": [
    "context",
    "workflow",
    "monorepo",
    "ai-agents",
    "grumpy-senior-engineer",
    "adr",
    "architecture-decision-records",
    "decisions",
    "planning",
    "plan-mode",
    "implementation"
  ],
  "skills": "./skills/",
  "hooks": "./hooks.codex.json"
}
