{
  "name": "humanizer",
  "version": "1.0.0",
  "description": "Remove signs of AI-generated writing from text. Use when editing or reviewing\ntext to make it sound more natural and human-written. Based on Wikipedia's\ncomprehensive \"Signs of AI writing\" guide. Detects and fixes patterns including:\ninflated symbolism, promotional language, superficial -ing analyses, vague\nattributions, em dash overuse, rule of three, AI vocabulary words, negative\nparallelisms, and excessive conjunctive phrases.",
  "skills": "./skills/"
}
